Original Sentence,Stemmed Tokens,Stemmed Sentence
"But don't try drinking that alcohol or even opening the bottle in your car, as that is strictly prohibited.","nt, tri, drink, alcohol, even, open, bottl, car, strictli, prohibit",nt tri drink alcohol even open bottl car strictli prohibit
Driving while under the influence of alcohol is permitted up to a blood-alcohol concentration (BAC) of 0.05.,"drive, influenc, alcohol, permit, bloodalcohol, concentr, bac",drive influenc alcohol permit bloodalcohol concentr bac
Learner drivers and probationary drivers are not allowed any alcohol in their blood.,"learner, driver, probationari, driver, allow, alcohol, blood",learner driver probationari driver allow alcohol blood
Drinking and driving is taken very seriously in Australia and random breath tests are not uncommon at all.,"drink, drive, taken, serious, australia, random, breath, test, uncommon",drink drive taken serious australia random breath test uncommon
"""Booze Buses"" will block a road and divert a random selection of passing cars to a breath testing station.","booz, buse, block, road, divert, random, select, pass, car, breath, test, station",booz buse block road divert random select pass car breath test station
Australia's public health system is run by Medicare.,"australia, public, health, system, run, medicar",australia public health system run medicar
"If you are a citizen of Ireland, New Zealand, the United Kingdom, Sweden, Finland, Norway, the Netherlands, Malta or Italy, you are entitled to subsidised health services [6] Otherwise, it is highly recommended to take out travel insurance, as medical services are quite expensive in Australia.","citizen, ireland, new, zealand, unit, kingdom, sweden, finland, norway, netherland, malta, itali, entitl, subsidis, health, servic, otherwis, highli, recommend, take, travel, insur, medic, servic, quit, expens, australia",citizen ireland new zealand unit kingdom sweden finland norway netherland malta itali entitl subsidis health servic otherwis highli recommend take travel insur medic servic quit expens australia
There are no required vaccinations for travel to Australia.,"requir, vaccin, travel, australia",requir vaccin travel australia
There is one exception though.,"one, except, though",one except though
You need a yellow fever vaccination if you have travelled to a country (7 days or less before entering Australia) where that disease is widely prevalent.,"need, yellow, fever, vaccin, travel, countri, day, less, enter, australia, diseas, wide, preval",need yellow fever vaccin travel countri day less enter australia diseas wide preval
"However, vaccines for DTP (Dyphtheria, Tetanus and Polio), Hepatitis A and Hepatitis B are recommended, as well as vaccines for Japanese encephalitis, depending on where and how long you will be travelling(reference).","howev, vaccin, dtp, dyphtheria, tetanu, polio, hepat, hepat, b, recommend, well, vaccin, japanes, enceph, depend, long, travel, refer",howev vaccin dtp dyphtheria tetanu polio hepat hepat b recommend well vaccin japanes enceph depend long travel refer
"Dengue sometimes occurs, but only in the northeast of the country.","dengu, sometim, occur, northeast, countri",dengu sometim occur northeast countri
"There is no vaccination, so buy mosquito repellent (preferably with 50% DEET), and sleep under a net.","vaccin, buy, mosquito, repel, prefer, deet, sleep, net",vaccin buy mosquito repel prefer deet sleep net
Also wear long sleeves if possible.,"also, wear, long, sleev, possibl",also wear long sleev possibl
"Finally, other possible health issues include diarrhea and other general travellers' diseases like motion sickness.","final, possibl, health, issu, includ, diarrhea, gener, travel, diseas, like, motion, sick",final possibl health issu includ diarrhea gener travel diseas like motion sick
"Watch what you eat and drink and in case you get it, drink plenty of fluids (to prevent dehydration) and bring ORS.","watch, eat, drink, case, get, drink, plenti, fluid, prevent, dehydr, bring, or",watch eat drink case get drink plenti fluid prevent dehydr bring or
"Australia is generally a safe place, though crime is by no means non-existent.","australia, gener, safe, place, though, crime, mean, nonexist",australia gener safe place though crime mean nonexist
"000 is the emergency telephone number in Australia, but the international GSM mobile emergency telephone number 112 also works on mobile phones.","emerg, telephon, number, australia, intern, gsm, mobil, emerg, telephon, number, also, work, mobil, phone",emerg telephon number australia intern gsm mobil emerg telephon number also work mobil phone
"Many travellers to Australia are concerned about crocodiles, sharks, and venomous spiders and snakes.","mani, travel, australia, concern, crocodil, shark, venom, spider, snake",mani travel australia concern crocodil shark venom spider snake
"Australia is certainly home to some deadly predators, including most of the top 10 of venomous snakes in the world.","australia, certainli, home, deadli, predat, includ, top, venom, snake, world",australia certainli home deadli predat includ top venom snake world
"While these threats are near non-existent in Australia's large cities, you are well advised to take the right precautions when you are out in the 'bush'.","threat, near, nonexist, australia, larg, citi, well, advis, take, right, precaut, bush",threat near nonexist australia larg citi well advis take right precaut bush
"Up north, don't swim in waters that you haven't verified as being safe.","north, nt, swim, water, nt, verifi, safe",north nt swim water nt verifi safe
"Usually, there are warning signs about 'salties' (salt water crocodiles, the 'freshies' are less of a concern).","usual, warn, sign, salti, salt, water, crocodil, freshi, less, concern",usual warn sign salti salt water crocodil freshi less concern
Shark attacks do occur but chances are very slim.,"shark, attack, occur, chanc, slim",shark attack occur chanc slim
Also note that spiders and snakes will usually notice you before you notice them and they will disappear immediately.,"also, note, spider, snake, usual, notic, notic, disappear, immedi",also note spider snake usual notic notic disappear immedi
"Bushfires are a common occurrence in parts of Australia, sometimes with devastating consequences.","bushfir, common, occurr, part, australia, sometim, devast, consequ",bushfir common occurr part australia sometim devast consequ
It is important to understand how to gauge the risks as you travel throughout the country.,"import, understand, gaug, risk, travel, throughout, countri",import understand gaug risk travel throughout countri
"In 2009, a national Fire Danger Ratings system was introduced to ensure all the states used the same terminology and standards.","nation, fire, danger, rate, system, introduc, ensur, state, use, terminolog, standard",nation fire danger rate system introduc ensur state use terminolog standard
"The levels of danger are as follows:
For most travellers, any fire danger rating over Very High should make you think about leaving.","level, danger, follow, travel, fire, danger, rate, high, make, think, leav",level danger follow travel fire danger rate high make think leav
The differences between the ratings are really targetted at people living in the area who may decide to stay and defend their homes against ember attacks.,"differ, rate, realli, target, peopl, live, area, may, decid, stay, defend, home, ember, attack",differ rate realli target peopl live area may decid stay defend home ember attack
"If you are going to leave an area, the recommendation is to leave the night before or early in the morning.","go, leav, area, recommend, leav, night, earli, morn",go leav area recommend leav night earli morn
"The worst place to be caught by a fire is in your car, so if you see smoke or flames then the safest place to be is in a building or on a sports oval where there is not much to burn around you.","worst, place, caught, fire, car, see, smoke, flame, safest, place, build, sport, oval, much, burn, around",worst place caught fire car see smoke flame safest place build sport oval much burn around
It is certainly not a good idea to go bush walking or camping on days where there is a high risk of fire.,"certainli, good, idea, go, bush, walk, camp, day, high, risk, fire",certainli good idea go bush walk camp day high risk fire
"If you plan to go camping in the bush during summer, always check weather forecasts in advance.","plan, go, camp, bush, summer, alway, check, weather, forecast, advanc",plan go camp bush summer alway check weather forecast advanc
"Fire Danger Ratings are published on the firefighting websites for each state and broadcast on the radio, tv and published in newspapers.","fire, danger, rate, publish, firefight, websit, state, broadcast, radio, tv, publish, newspap",fire danger rate publish firefight websit state broadcast radio tv publish newspap
It is also important to know when a Total Fire Ban applies to the area you're in.,"also, import, know, total, fire, ban, appli, area",also import know total fire ban appli area
These are in place to minimise the risk of fires starting.,"place, minimis, risk, fire, start",place minimis risk fire start
"These bans don't just rule out open fires and solid-fuel barbecues, but also things like welding and using machinery that might cause sparks.","ban, nt, rule, open, fire, solidfuel, barbecu, also, thing, like, weld, use, machineri, might, caus, spark",ban nt rule open fire solidfuel barbecu also thing like weld use machineri might caus spark
Internet cafés are very common in the larger Australian cities and popular tourist destinations.,"internet, caf, common, larger, australian, citi, popular, tourist, destin",internet caf common larger australian citi popular tourist destin
"However, once you leave the major population centres, you might have trouble finding somewhere to log on.","howev, leav, major, popul, centr, might, troubl, find, somewher, log",howev leav major popul centr might troubl find somewher log
"Free wifi is getting more and more common (either with or without a code) in places like restaurants, some bars and coffee places and hotels.","free, wifi, get, common, either, without, code, place, like, restaur, bar, coffe, place, hotel",free wifi get common either without code place like restaur bar coffe place hotel
Sometimes a fee is required.,"sometim, fee, requir",sometim fee requir
"Australia is on a GSM 900/1800 network, so if you have an unlocked phone that works on those frequencies, you will be able to buy a prepaid SIM-card and stick into your phone when you're in Australia.","australia, gsm, network, unlock, phone, work, frequenc, abl, buy, prepaid, simcard, stick, phone, australia",australia gsm network unlock phone work frequenc abl buy prepaid simcard stick phone australia
You will receive a new Australian phone number with the SIM-card.,"receiv, new, australian, phone, number, simcard",receiv new australian phone number simcard
"To dial out of Australia use the prefix 0011, followed by the calling code of the country you are trying to reach, followed by the area code of the city/town (without the 0!)","dial, australia, use, prefix, follow, call, code, countri, tri, reach, follow, area, code, citytown, without",dial australia use prefix follow call code countri tri reach follow area code citytown without
and finally the phone number.,"final, phone, number",final phone number
"Within Australia, it is necessary to add an area code to the phone numbers if you are calling from outside the area.","within, australia, necessari, add, area, code, phone, number, call, outsid, area",within australia necessari add area code phone number call outsid area
"Below are Australia's area codes:
000 is the emergency telephone number in Australia, but the international GSM mobile emergency telephone number 112 also works on mobile phones.","australia, area, code, emerg, telephon, number, australia, intern, gsm, mobil, emerg, telephon, number, also, work, mobil, phone",australia area code emerg telephon number australia intern gsm mobil emerg telephon number also work mobil phone
Australia Post is the government's postal service.,"australia, post, govern, postal, servic",australia post govern postal servic
Most suburbs will have at least one post office.,"suburb, least, one, post, offic",suburb least one post offic
Opening times are mostly from around 8:00 or 9:00am to 5:00pm though larger ones keep longer hours sometimes.,"open, time, mostli, around, pm, though, larger, one, keep, longer, hour, sometim",open time mostli around pm though larger one keep longer hour sometim
A standard letter or postcard sent within Australia will cost $0.60.,"standard, letter, postcard, sent, within, australia, cost",standard letter postcard sent within australia cost
"Internationally, it costs $1.70 to send postcards anywhere in the world.","intern, cost, send, postcard, anywher, world",intern cost send postcard anywher world
Letters cost $1.85 to send within the Asia Pacific region and $2.60 to anywhere else in the world.[7].,"letter, cost, send, within, asia, pacif, region, anywher, els, world",letter cost send within asia pacif region anywher els world
It is also possible to send things as parcels or by express mail.,"also, possibl, send, thing, parcel, express, mail",also possibl send thing parcel express mail
"You can also use use private courier companies like TNT, UPS or DHL as they are competitive and reliable.","also, use, use, privat, courier, compani, like, tnt, up, dhl, competit, reliabl",also use use privat courier compani like tnt up dhl competit reliabl
"as well as Jeremy80 (9%), KoalaGirl (6%), Marisarite (4%), dr.pepper (4%), Hien (2%), marko7 (1%), mojorob (1%), connaust (1%), Lavafalls (1%), escapedesigners (1%), BradAldcroft (<1%), louwright (<1%), soliqa (<1%), Rena13 (<1%), Pinny (<1%), The LostRo (<1%), travelblogger (<1%), ascough (<1%), Sam I Am (<1%), KellieBarnes (<1%)
I spent a year living in and travelling through (part of) Australia, and returned a couple of years later to hit spots I still managed to miss.","well, jeremi, koalagirl, marisarit, drpepper, hien, marko, mojorob, connaust, lavafal, escapedesign, bradaldcroft, louwright, soliqa, rena, pinni, lostro, travelblogg, ascough, sam, kelliebarn, spent, year, live, travel, part, australia, return, coupl, year, later, hit, spot, still, manag, miss",well jeremi koalagirl marisarit drpepper hien marko mojorob connaust lavafal escapedesign bradaldcroft louwright soliqa rena pinni lostro travelblogg ascough sam kelliebarn spent year live travel part australia return coupl year later hit spot still manag miss
"I never made it further north on the west coast than the Pinnacles Desert, nor to Darwin (shame on me!","never, made, north, west, coast, pinnacl, desert, darwin, shame",never made north west coast pinnacl desert darwin shame
"), and avoided a lot of the more touristy spots on the East Coast, but other than that I explored most of Adelaide to Cairns, with emphasis on the Melbourne and Sydney area.","avoid, lot, touristi, spot, east, coast, explor, adelaid, cairn, emphasi, melbourn, sydney, area",avoid lot touristi spot east coast explor adelaid cairn emphasi melbourn sydney area
"I have travelled by car from Melbourne to Darwin and from Sydney to Cairns, both along the coast as well as through the Outback.","travel, car, melbourn, darwin, sydney, cairn, along, coast, well, outback",travel car melbourn darwin sydney cairn along coast well outback
Probably I can help you with some Outback questions and how to travel around by car.,"probabl, help, outback, question, travel, around, car",probabl help outback question travel around car
"I live in Melbourne, Australia.","live, melbourn, australia",live melbourn australia
"If you have any questions about what life is like here or what you should see while visiting, just drop me a note.","question, life, like, see, visit, drop, note",question life like see visit drop note
I'm always happy to help out.,"alway, happi, help",alway happi help
Touring the East Coast.Getting your bearings in Sydney.Great Barrier Reef trips.,"tour, east, coastget, bear, sydneygreat, barrier, reef, trip",tour east coastget bear sydneygreat barrier reef trip
"I currently live in Sydney, but I wasn't born here.","current, live, sydney, nt, born",current live sydney nt born
"I moved here two years ago with my family and have been attending uni here since then, so I've gotten to know lots of different areas of the city, and I have plenty of contacts if you need information about the Blue Mountains or other areas close to the city.","move, two, year, ago, famili, attend, uni, sinc, gotten, know, lot, differ, area, citi, plenti, contact, need, inform, blue, mountain, area, close, citi",move two year ago famili attend uni sinc gotten know lot differ area citi plenti contact need inform blue mountain area close citi
I can help orienting you as a traveller or as someone looking for real local flavour.,"help, orient, travel, someon, look, real, local, flavour",help orient travel someon look real local flavour
I also know my way around Melbourne as a traveller and can really help out with local restaurants to both Sydney and Melbourne!,"also, know, way, around, melbourn, travel, realli, help, local, restaur, sydney, melbourn",also know way around melbourn travel realli help local restaur sydney melbourn
This is version 286.,version,version
"Last edited at 11:13 on Oct 1, 19 by Peter.","last, edit, oct, peter",last edit oct peter
"### Italy ###
For only $3 per month you can become a Travellerspoint Supporter
              and enjoy an ad free experience.","itali, per, month, becom, travellerspoint, support, enjoy, ad, free, experi",itali per month becom travellerspoint support enjoy ad free experi
"Italy is the home of culture, some of soccer's finest teams, the Roman Catholic church and quality food and dishes.","itali, home, cultur, soccer, finest, team, roman, cathol, church, qualiti, food, dish",itali home cultur soccer finest team roman cathol church qualiti food dish
"Quite simply, this is a place of such diversity that the only thing that will stop you spending the rest of your days here is an empty wallet.","quit, simpli, place, divers, thing, stop, spend, rest, day, empti, wallet",quit simpli place divers thing stop spend rest day empti wallet
"Museums display some of the most beautiful art works ever made; but the living, breathing Italy that operates outside museum doors has enough beauty to suffice the average visitor.","museum, display, beauti, art, work, ever, made, live, breath, itali, oper, outsid, museum, door, enough, beauti, suffic, averag, visitor",museum display beauti art work ever made live breath itali oper outsid museum door enough beauti suffic averag visitor
"Stroll down the streets of Rome, Florence, Naples or Venice, and you will be struck by the wealth of history and culture tied up in the cobbled streets, baroque styled buildings, or beautiful chapels.","stroll, street, rome, florenc, napl, venic, struck, wealth, histori, cultur, tie, cobbl, street, baroqu, style, build, beauti, chapel",stroll street rome florenc napl venic struck wealth histori cultur tie cobbl street baroqu style build beauti chapel
"Natural beauty abounds, too: gorgeous stretches of coastline; the Alps sealing off the northern border; and the people, of course.","natur, beauti, abound, gorgeou, stretch, coastlin, alp, seal, northern, border, peopl, cours",natur beauti abound gorgeou stretch coastlin alp seal northern border peopl cours
"Best of all, Italy is home of pizza, pasta and cappuccino, so expect a culinary experience superior to any Pizza Hut meal you've ever had.","best, itali, home, pizza, pasta, cappuccino, expect, culinari, experi, superior, pizza, hut, meal, ever",best itali home pizza pasta cappuccino expect culinari experi superior pizza hut meal ever
Many have flocked to Tuscany and Umbria to find the real Italy.,"mani, flock, tuscani, umbria, find, real, itali",mani flock tuscani umbria find real itali
But much to be explored are the Le Marche and latterly the Abruzzo - where property prices are beginning to soar!,"much, explor, le, march, latterli, abruzzo, properti, price, begin, soar",much explor le march latterli abruzzo properti price begin soar
"Each region has its own particular choice of dishes
The history of the Italian peninsula can be divided quite neatly in seven distinct periods, spanning almost three millennia of human civilisation.","region, particular, choic, dish, histori, italian, peninsula, divid, quit, neatli, seven, distinct, period, span, almost, three, millennia, human, civilis",region particular choic dish histori italian peninsula divid quit neatli seven distinct period span almost three millennia human civilis
"The earliest evidence of human presence on the Italian peninsula dates back to 16,000 BC, although nothing much can be said of the period before the late Iron Age (approximately 800 BC) when early Greeks founded colonies on the southeast of the peninsula and Sicily.","earliest, evid, human, presenc, italian, peninsula, date, back, bc, although, noth, much, said, period, late, iron, age, approxim, bc, earli, greek, found, coloni, southeast, peninsula, sicili",earliest evid human presenc italian peninsula date back bc although noth much said period late iron age approxim bc earli greek found coloni southeast peninsula sicili
"Etruscan presence in central Italy dates back to the same period, who were to rule these lands as a kingdom that prospered almost 700 years.","etruscan, presenc, central, itali, date, back, period, rule, land, kingdom, prosper, almost, year",etruscan presenc central itali date back period rule land kingdom prosper almost year
The principal remains of Etruscan civilisation can still be visited near Cerveteri; much of the Greek remains can be seen in Campania and on Sicily.,"princip, remain, etruscan, civilis, still, visit, near, cerveteri, much, greek, remain, seen, campania, sicili",princip remain etruscan civilis still visit near cerveteri much greek remain seen campania sicili
The Roman period consists of three main eras.,"roman, period, consist, three, main, era",roman period consist three main era
"The era of (Etruscan) kings (753 BC - 509 BC), during this time Rome did not extended beyond present day Italy.","era, etruscan, king, bc, bc, time, rome, extend, beyond, present, day, itali",era etruscan king bc bc time rome extend beyond present day itali
During the Etruscan era there was very little Greek influence.,"etruscan, era, littl, greek, influenc",etruscan era littl greek influenc
"The Roman Republic, which went from 509 BC to 31 BC, this was the time that the senate ruled Rome and it eventually became more and more corrupt.","roman, republ, went, bc, bc, time, senat, rule, rome, eventu, becam, corrupt",roman republ went bc bc time senat rule rome eventu becam corrupt
This lead to Julius Caesar's storming into Rome with his soldiers and making himself dictator.,"lead, juliu, caesar, storm, rome, soldier, make, dictat",lead juliu caesar storm rome soldier make dictat
After the Senate organized an assassination which made Rome descend into chaos.,"senat, organ, assassin, made, rome, descend, chao",senat organ assassin made rome descend chao
"Augustus Caesar came to power starting the Roman Empire, which went from 31 BC to 476 AD.","augustu, caesar, came, power, start, roman, empir, went, bc, ad",augustu caesar came power start roman empir went bc ad
With the rise of Christianity the empire changed greatly and started to deteriorate.,"rise, christian, empir, chang, greatli, start, deterior",rise christian empir chang greatli start deterior
The empire was split in 286 and at roughly the same time christianity was legalized.,"empir, split, roughli, time, christian, legal",empir split roughli time christian legal
In 476 AD due to great corruption and inability even to protect the city of Rome the western empire fell.,"ad, due, great, corrupt, inabl, even, protect, citi, rome, western, empir, fell",ad due great corrupt inabl even protect citi rome western empir fell
Although most areas continued to keep Roman laws and legal systems and the legacy of the Catholic Church can be felt to this day.,"although, area, continu, keep, roman, law, legal, system, legaci, cathol, church, felt, day",although area continu keep roman law legal system legaci cathol church felt day
"After 476 AD, the Eastern Roman Empire, Byzantine Empire, remained together until 1453 AD with its capital in current day Istanbul.","ad, eastern, roman, empir, byzantin, empir, remain, togeth, ad, capit, current, day, istanbul",ad eastern roman empir byzantin empir remain togeth ad capit current day istanbul
"Several times it tried to retake the western empire but was never successful because of cultural difference between Catholics and Orthodox beliefs, also the identity of tribes had grown so strong that rebuilding a larger Roman identity could not be done.","sever, time, tri, retak, western, empir, never, success, cultur, differ, cathol, orthodox, belief, also, ident, tribe, grown, strong, rebuild, larger, roman, ident, could, done",sever time tri retak western empir never success cultur differ cathol orthodox belief also ident tribe grown strong rebuild larger roman ident could done
"After the fall of the Roman Empire, Italy existed of many smaller states and city states, and was invaded many times by foreign forces.","fall, roman, empir, itali, exist, mani, smaller, state, citi, state, invad, mani, time, foreign, forc",fall roman empir itali exist mani smaller state citi state invad mani time foreign forc
