Original Sentence,Stemmed Tokens,Stemmed Sentence
"One of the biggest is Catania-Fontanarossa Airport in the west of Sicily, although also Palermo Airport receives a significant number of flights from places throughout Europe.","one, biggest, cataniafontanarossa, airport, west, sicili, although, also, palermo, airport, receiv, signific, number, flight, place, throughout, europ",one biggest cataniafontanarossa airport west sicili although also palermo airport receiv signific number flight place throughout europ
"The largest one on Sardinia is the Cagliari-Elmas Airport, although Alghero Airport and Olbia-Costa Smeralda Airport have flights as well.","largest, one, sardinia, cagliarielma, airport, although, alghero, airport, olbiacosta, smeralda, airport, flight, well",largest one sardinia cagliarielma airport although alghero airport olbiacosta smeralda airport flight well
"From France, Italy can be reached by the EC train via the coast (Nice - Ventimiglia - Genoa) or by TGV via the Fréjus tunnel (Chambéry - Bardonecchia - Turin).","franc, itali, reach, ec, train, via, coast, nice, ventimiglia, genoa, tgv, via, frju, tunnel, chambri, bardonecchia, turin",franc itali reach ec train via coast nice ventimiglia genoa tgv via frju tunnel chambri bardonecchia turin
"From Switzerland, there are frequent EC trains between Basel and Milan, calling at Chiasso.","switzerland, frequent, ec, train, basel, milan, call, chiasso",switzerland frequent ec train basel milan call chiasso
"From Austria, there are nightly and daily trains between Vienna and Venice, calling at the border town of Villach.","austria, nightli, daili, train, vienna, venic, call, border, town, villach",austria nightli daili train vienna venic call border town villach
"Between Italy and Slovenia, there is a connection in the north at Nova Gorica/Gorizia, and one in the south near Sežana, on the route of the Euronight train between Budapest and Venice.","itali, slovenia, connect, north, nova, goricagorizia, one, south, near, seana, rout, euronight, train, budapest, venic",itali slovenia connect north nova goricagorizia one south near seana rout euronight train budapest venic
"International tickets can be booked through Trenitalia or one of the other national carriers involved, or via a travel agency.","intern, ticket, book, trenitalia, one, nation, carrier, involv, via, travel, agenc",intern ticket book trenitalia one nation carrier involv via travel agenc
Note that the online payment facility of the Trenitalia website is known to cause frequent problems when used with non-Italian credit cards.,"note, onlin, payment, facil, trenitalia, websit, known, caus, frequent, problem, use, nonitalian, credit, card",note onlin payment facil trenitalia websit known caus frequent problem use nonitalian credit card
"For more information, see the international trains article.","inform, see, intern, train, articl",inform see intern train articl
"From France, Italy can be reached by A5 via the Mont Blanc tunnel, by A32 via the Fréjus tunnel, and by A10 via Nice.","franc, itali, reach, via, mont, blanc, tunnel, via, frju, tunnel, via, nice",franc itali reach via mont blanc tunnel via frju tunnel via nice
"From Switzerland, there is A9 via Chiasso.","switzerland, via, chiasso",switzerland via chiasso
"From Austria, the A22 enters Italy via Brennero, and A23 in the east near Tarvisio.","austria, enter, itali, via, brennero, east, near, tarvisio",austria enter itali via brennero east near tarvisio
"From Slovenia, there are no highways into Italy, but there are several provincial routes that you can take.","slovenia, highway, itali, sever, provinci, rout, take",slovenia highway itali sever provinci rout take
"If you want to go by bus, Eurolines has direct connections to various destinations in Italy.","want, go, bu, eurolin, direct, connect, variou, destin, itali",want go bu eurolin direct connect variou destin itali
Milan serves as a major hub in their network with lots of connections to both western and eastern Europe.,"milan, serv, major, hub, network, lot, connect, western, eastern, europ",milan serv major hub network lot connect western eastern europ
"Italy being a peninsula, there are many possible entry points for those wanting to arrive by water.","itali, peninsula, mani, possibl, entri, point, want, arriv, water",itali peninsula mani possibl entri point want arriv water
"For bookings on most ferries, you can use Ferriesonline or Viamare.","book, ferri, use, ferriesonlin, viamar",book ferri use ferriesonlin viamar
"Off-season, you can get much better deals just showing up at the harbour, although this typically requires some flexibility in your travel plans, as many routes don't have daily service.","offseason, get, much, better, deal, show, harbour, although, typic, requir, flexibl, travel, plan, mani, rout, nt, daili, servic",offseason get much better deal show harbour although typic requir flexibl travel plan mani rout nt daili servic
"Italy can be reached across the Adriatic from Croatia, Slovenia and Montenegro.","itali, reach, across, adriat, croatia, slovenia, montenegro",itali reach across adriat croatia slovenia montenegro
"Across the Ionean Sea lie Greece, Albania and Malta (no direct connections with Turkey exist).","across, ionean, sea, lie, greec, albania, malta, direct, connect, turkey, exist",across ionean sea lie greec albania malta direct connect turkey exist
"Across the Mediterranean proper lie Spain, France, Tunisia and Morocco (no direct connections exist with Libya, Egypt and Algeria, nor with Israel, Lebanon and Syria).","across, mediterranean, proper, lie, spain, franc, tunisia, morocco, direct, connect, exist, libya, egypt, algeria, israel, lebanon, syria",across mediterranean proper lie spain franc tunisia morocco direct connect exist libya egypt algeria israel lebanon syria
"Of course you can fly around Italy, but why should you?","cours, fli, around, itali",cours fli around itali
"It is quite expensive, and most local airfields are difficult to reach without a car.","quit, expens, local, airfield, difficult, reach, without, car",quit expens local airfield difficult reach without car
"Basically, flying is only a feasible means of transport if you want to get from northern Italy (Milan or further up north) to the region south of Naples, including Sicily.","basic, fli, feasibl, mean, transport, want, get, northern, itali, milan, north, region, south, napl, includ, sicili",basic fli feasibl mean transport want get northern itali milan north region south napl includ sicili
"On all other itineraries, the train will be about as fast and much cheaper.","itinerari, train, fast, much, cheaper",itinerari train fast much cheaper
"Short of driving a car, going by train is the best way to explore Italy.","short, drive, car, go, train, best, way, explor, itali",short drive car go train best way explor itali
"The Italian railroad network is amazingly widespread, and even remote areas in central and southern Italy have several connections daily to the outside world.","italian, railroad, network, amazingli, widespread, even, remot, area, central, southern, itali, sever, connect, daili, outsid, world",italian railroad network amazingli widespread even remot area central southern itali sever connect daili outsid world
"On a downside, Italy's national railway carrier Ferrovie dello Stato (FS), is the country's finest example of mismanagement and bureaucracy in state-owned companies, and is excruciatingly slow and inefficient, especially to the 'western' eye.","downsid, itali, nation, railway, carrier, ferrovi, dello, stato, fs, countri, finest, exampl, mismanag, bureaucraci, stateown, compani, excruciatingli, slow, ineffici, especi, western, eye",downsid itali nation railway carrier ferrovi dello stato fs countri finest exampl mismanag bureaucraci stateown compani excruciatingli slow ineffici especi western eye
"Still, service is cheap, and with a bit of patience and perseverance, gets you everywhere.","still, servic, cheap, bit, patienc, persever, get, everywher",still servic cheap bit patienc persever get everywher
"Just allow for plenty (really, plenty: 4-6 hours is not exaggerated) of extra time when you need to make some kind of deadline.","allow, plenti, realli, plenti, hour, exagger, extra, time, need, make, kind, deadlin",allow plenti realli plenti hour exagger extra time need make kind deadlin
"FS operates the following train types on national connections:
A map of the Italian railroad network can be downloaded here.","fs, oper, follow, train, type, nation, connect, map, italian, railroad, network, download",fs oper follow train type nation connect map italian railroad network download
"Booking and buying tickets can be done at the counter at any FS station, or at ticket machines on larger stations.","book, buy, ticket, done, counter, fs, station, ticket, machin, larger, station",book buy ticket done counter fs station ticket machin larger station
"Personnel operating the counters can be slow and, outside major tourist destinations, not proficient in English, but is usually friendly and patient.","personnel, oper, counter, slow, outsid, major, tourist, destin, profici, english, usual, friendli, patient",personnel oper counter slow outsid major tourist destin profici english usual friendli patient
"Best pay with cash, since foreign debit and credit cards are known to slow down the purchasing even further.","best, pay, cash, sinc, foreign, debit, credit, card, known, slow, purchas, even",best pay cash sinc foreign debit credit card known slow purchas even
"Try to avoid the international counters at Roma Termini station; going to another station, for instance Roma Tiburtina, will save you time.","tri, avoid, intern, counter, roma, termini, station, go, anoth, station, instanc, roma, tiburtina, save, time",tri avoid intern counter roma termini station go anoth station instanc roma tiburtina save time
"Don't bother trying to book tickets over the internet: although the FS website offers that facility, it does not work with foreign accounts.","nt, bother, tri, book, ticket, internet, although, fs, websit, offer, facil, work, foreign, account",nt bother tri book ticket internet although fs websit offer facil work foreign account
"If you want to go to out-of-the-way places, exploring Italy by car is your best option.","want, go, outoftheway, place, explor, itali, car, best, option",want go outoftheway place explor itali car best option
"The roads are of good overall quality, ranging from outstanding in the north to average in central Italy, to acceptable in the south and on the islands (Sicily and Sardinia).","road, good, overal, qualiti, rang, outstand, north, averag, central, itali, accept, south, island, sicili, sardinia",road good overal qualiti rang outstand north averag central itali accept south island sicili sardinia
"In the deep south, expect to encounter a lot of potholes and very few gas stations off the highway (E45/A3 south of Salerno; E55/A14 south of Foggia).","deep, south, expect, encount, lot, pothol, ga, station, highway, ea, south, salerno, ea, south, foggia",deep south expect encount lot pothol ga station highway ea south salerno ea south foggia
"If you bring a vehicle running on LPG instead of petrol or diesel, consult your local AAA beforehand, since availability tends to be seasonal.","bring, vehicl, run, lpg, instead, petrol, diesel, consult, local, aaa, beforehand, sinc, avail, tend, season",bring vehicl run lpg instead petrol diesel consult local aaa beforehand sinc avail tend season
"The Italians drive assertively, but nothing as crazy as countryside Portugal or South America.","italian, drive, assert, noth, crazi, countrysid, portug, south, america",italian drive assert noth crazi countrysid portug south america
Their main issues appear to be the observance of speed limits and lending priority.,"main, issu, appear, observ, speed, limit, lend, prioriti",main issu appear observ speed limit lend prioriti
You need to be over 18 and in the possession of an international driver's licence in order to operate a vehicle.,"need, possess, intern, driver, licenc, order, oper, vehicl",need possess intern driver licenc order oper vehicl
"The use of seatbelts is compulsory, as is using your headlights on all highways.","use, seatbelt, compulsori, use, headlight, highway",use seatbelt compulsori use headlight highway
Using a cell phone is forbidden while driving.,"use, cell, phone, forbidden, drive",use cell phone forbidden drive
The usual European traffic rules apply.,"usual, european, traffic, rule, appli",usual european traffic rule appli
"Watch out for cyclists, who can use all roads except national highways.","watch, cyclist, use, road, except, nation, highway",watch cyclist use road except nation highway
"Needless to say, Italy has right-side driving.","needless, say, itali, rightsid, drive",needless say itali rightsid drive
"Rentals are widely available, mostly at airports but also in downtown areas.","rental, wide, avail, mostli, airport, also, downtown, area",rental wide avail mostli airport also downtown area
"In addition to a valid ID, international driver's license and a credit card, a collision damage waiver and theft protection are mandatory when renting a vehicle; check with your travel insurance in advance.","addit, valid, id, intern, driver, licens, credit, card, collis, damag, waiver, theft, protect, mandatori, rent, vehicl, check, travel, insur, advanc",addit valid id intern driver licens credit card collis damag waiver theft protect mandatori rent vehicl check travel insur advanc
Additional protection in case of accidents etc.,"addit, protect, case, accid, etc",addit protect case accid etc
can usually be purchased locally.,"usual, purchas, local",usual purchas local
"Most agencies, including those that operate internationally, do not allow you to cross the border with your rental; drop-off in other cities is usually possible.","agenc, includ, oper, intern, allow, cross, border, rental, dropoff, citi, usual, possibl",agenc includ oper intern allow cross border rental dropoff citi usual possibl
"Easyterra offers a decent comparison between companies, although booking directly is obviously cheaper.","easyterra, offer, decent, comparison, compani, although, book, directli, obvious, cheaper",easyterra offer decent comparison compani although book directli obvious cheaper
"During European school holidays, best book in advance, especially for pick-up locations in the triangle Turin - Venice - Rome.","european, school, holiday, best, book, advanc, especi, pickup, locat, triangl, turin, venic, rome",european school holiday best book advanc especi pickup locat triangl turin venic rome
"In the unlikely event you want to go where trains can't take you, there's always the option of going by bus.","unlik, event, want, go, train, ca, nt, take, alway, option, go, bu",unlik event want go train ca nt take alway option go bu
"Buses in Italy roughly come in two types: suburban transportation under the supervision of local government, and regional transportation under supervision of regional and/or provincial authorities.","buse, itali, roughli, come, two, type, suburban, transport, supervis, local, govern, region, transport, supervis, region, andor, provinci, author",buse itali roughli come two type suburban transport supervis local govern region transport supervis region andor provinci author
"The frequency of service can vary tremendously according to region and season, but you can generally count on each route being serviced 3 or 4 times a day.","frequenc, servic, vari, tremend, accord, region, season, gener, count, rout, servic, time, day",frequenc servic vari tremend accord region season gener count rout servic time day
"In addition, Eurolines operates a number of long-distance services in Italy.","addit, eurolin, oper, number, longdist, servic, itali",addit eurolin oper number longdist servic itali
"Bus terminals tend to be located in the outskirts of large cities, or near train stations.","bu, termin, tend, locat, outskirt, larg, citi, near, train, station",bu termin tend locat outskirt larg citi near train station
"The main bus terminal of Rome is Anagnina, which can be reached by subway.","main, bu, termin, rome, anagnina, reach, subway",main bu termin rome anagnina reach subway
"Except when visiting Sicily, Sardinia or one of the smaller islands, taking a ferry is not a feasible way to save time or money.","except, visit, sicili, sardinia, one, smaller, island, take, ferri, feasibl, way, save, time, money",except visit sicili sardinia one smaller island take ferri feasibl way save time money
"Ferries are an excellent option for international travel, though; more information is given above.","ferri, excel, option, intern, travel, though, inform, given",ferri excel option intern travel though inform given
"The main Mediterranean ports in Italy are Civitavecchia near Rome, and Genoa; the main Adriatic ports are Ancona and Brindisi.","main, mediterranean, port, itali, civitavecchia, near, rome, genoa, main, adriat, port, ancona, brindisi",main mediterranean port itali civitavecchia near rome genoa main adriat port ancona brindisi
Possible ferries to take include Moby Lines andGrimaldi Lines.,"possibl, ferri, take, includ, mobi, line, andgrimaldi, line",possibl ferri take includ mobi line andgrimaldi line
"There are also numerous ferries that ply the routes to smaller islands off the coast of mainland Italy, like Elba and Capri.","also, numer, ferri, pli, rout, smaller, island, coast, mainland, itali, like, elba, capri",also numer ferri pli rout smaller island coast mainland itali like elba capri
It is beyond the scope of this article to mention all of them but a good idea of the possibilities can be found on this ferry website.,"beyond, scope, articl, mention, good, idea, possibl, found, ferri, websit",beyond scope articl mention good idea possibl found ferri websit
"If you are a European Union (EU) citizen, you may enter without any restriction as per your EU citizenship rights.","european, union, eu, citizen, may, enter, without, restrict, per, eu, citizenship, right",european union eu citizen may enter without restrict per eu citizenship right
"If you are not an EU citizen, you might need to obtain a Schengen Visa.","eu, citizen, might, need, obtain, schengen, visa",eu citizen might need obtain schengen visa
This visa is valid for any country in the Schengen zone.,"visa, valid, countri, schengen, zone",visa valid countri schengen zone
"Italy has adopted the Euro (ISO code: EUR, symbol: €) as its official currency.","itali, adopt, euro, iso, code, eur, symbol, offici, currenc",itali adopt euro iso code eur symbol offici currenc
"One Euro is divided into 100 cents, which is sometimes referred to as eurocents, especially when distinguishing them with the US cents.","one, euro, divid, cent, sometim, refer, euroc, especi, distinguish, us, cent",one euro divid cent sometim refer euroc especi distinguish us cent
"Euro banknotes come in denominations of €5, €10, €20, €50, €100, €200, €500.","euro, banknot, come, denomin",euro banknot come denomin
The highest three denominations are rarely used in everyday transactions.,"highest, three, denomin, rare, use, everyday, transact",highest three denomin rare use everyday transact
All Euro banknotes have a common design for each denomination on both sides throughout the Eurozone.,"euro, banknot, common, design, denomin, side, throughout, eurozon",euro banknot common design denomin side throughout eurozon
"The Euro coins are 1 cent, 2 cents, 5 cents, 10 cents, 20 cents, 50 cents, €1 and €2.","euro, coin, cent, cent, cent, cent, cent, cent",euro coin cent cent cent cent cent cent
Some countries in the Eurozone have law which requires cash transactions to be rounded to the nearest 5 cents.,"countri, eurozon, law, requir, cash, transact, round, nearest, cent",countri eurozon law requir cash transact round nearest cent
"All Euro coins have a common design on the denomination (value) side, while the opposite side may have a different image from one country to another.","euro, coin, common, design, denomin, valu, side, opposit, side, may, differ, imag, one, countri, anoth",euro coin common design denomin valu side opposit side may differ imag one countri anoth
"Although the image side may be different, all Euro coins remain legal tender throughout the Eurozone.","although, imag, side, may, differ, euro, coin, remain, legal, tender, throughout, eurozon",although imag side may differ euro coin remain legal tender throughout eurozon
The image for the Italy coin is the Colosseum in Rome.,"imag, itali, coin, colosseum, rome",imag itali coin colosseum rome
Work in Italy is not easy to find.,"work, itali, easi, find",work itali easi find
"Many young adults, especially women, are without a job.","mani, young, adult, especi, women, without, job",mani young adult especi women without job
"There's a huge underground black market though, where you'll find many people working not being book-regulated.","huge, underground, black, market, though, find, mani, peopl, work, bookregul",huge underground black market though find mani peopl work bookregul
"Most ""black"" workers can be found in small business such as bars, pubs and small shops, or as construction workers.","black, worker, found, small, busi, bar, pub, small, shop, construct, worker",black worker found small busi bar pub small shop construct worker
Although this kind of job is illegal (but legal consequences are most on the employer) they're probably the easier thing to find if you're looking for a temporary job.,"although, kind, job, illeg, legal, consequ, employ, probabl, easier, thing, find, look, temporari, job",although kind job illeg legal consequ employ probabl easier thing find look temporari job
"For English-speakers looking to study in Italy, there are several options.","englishspeak, look, studi, itali, sever, option",englishspeak look studi itali sever option
"In Rome, Duquesne University, John Cabot, Loyola University Chicago and Temple University maintain campuses.","rome, duquesn, univers, john, cabot, loyola, univers, chicago, templ, univers, maintain, campus",rome duquesn univers john cabot loyola univers chicago templ univers maintain campus
Right outside of Rome the University of Dallas maintains its own campus in Marino.,"right, outsid, rome, univers, dalla, maintain, campu, marino",right outsid rome univers dalla maintain campu marino
St. John's University has a graduate program in Rome for International Relations and MBA.,"st, john, univers, graduat, program, rome, intern, relat, mba",st john univers graduat program rome intern relat mba
New York University has a study-abroad program in Florence available even to freshmen and maintains its own campus at Villa La Pietra.,"new, york, univers, studyabroad, program, florenc, avail, even, freshmen, maintain, campu, villa, la, pietra",new york univers studyabroad program florenc avail even freshmen maintain campu villa la pietra
"The official Italian language, although closer to its predecessor than any of its Romance relatives, was not codified until 1860 when Alessandro Manzoni wrote I promessi sposi, which is generally recognised as the birth of modern Italian.","offici, italian, languag, although, closer, predecessor, romanc, rel, codifi, alessandro, manzoni, wrote, promessi, sposi, gener, recognis, birth, modern, italian",offici italian languag although closer predecessor romanc rel codifi alessandro manzoni wrote promessi sposi gener recognis birth modern italian
"However, as is often the case with national languages, its use remained restricted to the area of politics and public government for most of its existence, while peple continued to use their local, provincial and regional dialects instead.","howev, often, case, nation, languag, use, remain, restrict, area, polit, public, govern, exist, pepl, continu, use, local, provinci, region, dialect, instead",howev often case nation languag use remain restrict area polit public govern exist pepl continu use local provinci region dialect instead
"Only in the last 40 years has standard Italian begun to be a significant influence in culture, news and literature.","last, year, standard, italian, begun, signific, influenc, cultur, news, literatur",last year standard italian begun signific influenc cultur news literatur
"Grammatically, Italian strongly resembles the Tuscan dialect, while phonetically, it is much closer to varieties spoken around Padua.","grammat, italian, strongli, resembl, tuscan, dialect, phonet, much, closer, varieti, spoken, around, padua",grammat italian strongli resembl tuscan dialect phonet much closer varieti spoken around padua
"Foreigners generally appreciate the clear sound and transparent grammar, although either may pose problems depending on one's own language background.","foreign, gener, appreci, clear, sound, transpar, grammar, although, either, may, pose, problem, depend, one, languag, background",foreign gener appreci clear sound transpar grammar although either may pose problem depend one languag background
"Two areas of Italian syntax that are notorious for causing problems for non-native speakers are the correct inflection and use of the many verbal tenses (the regular verbal paradigm of Italian comprises well over a 100 forms per stem), and the use of impersonal pronouns.","two, area, italian, syntax, notori, caus, problem, nonn, speaker, correct, inflect, use, mani, verbal, tens, regular, verbal, paradigm, italian, compris, well, form, per, stem, use, imperson, pronoun",two area italian syntax notori caus problem nonn speaker correct inflect use mani verbal tens regular verbal paradigm italian compris well form per stem use imperson pronoun
